{
  "schema_version": 1,
  "catalog_id": "djsupport/apsw-runtime-artifacts/1",
  "selected_binding": {
    "distribution": "apsw",
    "version": "3.53.4.0"
  },
  "publisher": {
    "kind": "GitHub",
    "repository": "rogerbinns/apsw",
    "workflow": "build-pypi.yml",
    "source_repository_url": "https://github.com/rogerbinns/apsw",
    "source_commit": "09b6a89e13e1c49f13bfb92fdb8725d1a0f03b5a",
    "workflow_url": "https://github.com/rogerbinns/apsw/actions/workflows/build-pypi.yml"
  },
  "artifacts": [
    {
      "artifact_id": "apsw/3.53.4.0/ubuntu-24.04/3.10.21",
      "runner_label": "ubuntu-24.04",
      "python_version": "3.10.21",
      "architecture": "x86_64",
      "os": "Ubuntu",
      "os_version_family": "24.04",
      "product_type": "not_applicable",
      "filename": "apsw-3.53.4.0-cp310-cp310-manylinux_2_28_x86_64.whl",
      "platform_tag": "manylinux_2_28_x86_64",
      "download_url": "https://files.pythonhosted.org/packages/a8/d6/b32dd63ae11fac0738cc3789e9c48e2e13ba27115ed6e806cd4556c8f56f/apsw-3.53.4.0-cp310-cp310-manylinux_2_28_x86_64.whl",
      "size_bytes": 3699869,
      "sha256": "cad12a70fae847c7b0fcf98ba0299ffcfe9c51c9f0f7764185bd91a2c709c937",
      "provenance_url": "https://pypi.org/integrity/apsw/3.53.4.0/apsw-3.53.4.0-cp310-cp310-manylinux_2_28_x86_64.whl/provenance",
      "uploaded_at_utc": "2026-07-26T17:00:00.918090Z"
    },
    {
      "artifact_id": "apsw/3.53.4.0/ubuntu-24.04/3.11.16",
      "runner_label": "ubuntu-24.04",
      "python_version": "3.11.16",
      "architecture": "x86_64",
      "os": "Ubuntu",
      "os_version_family": "24.04",
      "product_type": "not_applicable",
      "filename": "apsw-3.53.4.0-cp311-cp311-manylinux_2_28_x86_64.whl",
      "platform_tag": "manylinux_2_28_x86_64",
      "download_url": "https://files.pythonhosted.org/packages/a6/cc/bbe97dc8d32f417c3cfc22b942b271ef41c5a04ee530873555bf1e7b737d/apsw-3.53.4.0-cp311-cp311-manylinux_2_28_x86_64.whl",
      "size_bytes": 3652275,
      "sha256": "cca0a8a4498a355326fb491d852187c2fd2031d3e61925e349ba297d3ab884f4",
      "provenance_url": "https://pypi.org/integrity/apsw/3.53.4.0/apsw-3.53.4.0-cp311-cp311-manylinux_2_28_x86_64.whl/provenance",
      "uploaded_at_utc": "2026-07-26T17:00:28.073141Z"
    },
    {
      "artifact_id": "apsw/3.53.4.0/ubuntu-24.04/3.12.14",
      "runner_label": "ubuntu-24.04",
      "python_version": "3.12.14",
      "architecture": "x86_64",
      "os": "Ubuntu",
      "os_version_family": "24.04",
      "product_type": "not_applicable",
      "filename": "apsw-3.53.4.0-cp312-cp312-manylinux_2_28_x86_64.whl",
      "platform_tag": "manylinux_2_28_x86_64",
      "download_url": "https://files.pythonhosted.org/packages/bc/20/c83561b62be054bc0d04216b7d1cb037c4d95078a8250a062a61bd1a6659/apsw-3.53.4.0-cp312-cp312-manylinux_2_28_x86_64.whl",
      "size_bytes": 3642941,
      "sha256": "6c47c64ca9c2fac2b476317210b6e8c04681fb718594c0806bd33e5d2b459dff",
      "provenance_url": "https://pypi.org/integrity/apsw/3.53.4.0/apsw-3.53.4.0-cp312-cp312-manylinux_2_28_x86_64.whl/provenance",
      "uploaded_at_utc": "2026-07-26T17:00:54.135048Z"
    },
    {
      "artifact_id": "apsw/3.53.4.0/ubuntu-24.04/3.13.15",
      "runner_label": "ubuntu-24.04",
      "python_version": "3.13.15",
      "architecture": "x86_64",
      "os": "Ubuntu",
      "os_version_family": "24.04",
      "product_type": "not_applicable",
      "filename": "apsw-3.53.4.0-cp313-cp313-manylinux_2_28_x86_64.whl",
      "platform_tag": "manylinux_2_28_x86_64",
      "download_url": "https://files.pythonhosted.org/packages/34/bd/96c6c932c8c13a1440c3a166bc53a24c967aef68af9ef687a08d9232fc41/apsw-3.53.4.0-cp313-cp313-manylinux_2_28_x86_64.whl",
      "size_bytes": 3647879,
      "sha256": "c6c262ce950cbd831b52fffd0e39e5ca4bd6dc60ce048d0d6e44dae7204634a9",
      "provenance_url": "https://pypi.org/integrity/apsw/3.53.4.0/apsw-3.53.4.0-cp313-cp313-manylinux_2_28_x86_64.whl/provenance",
      "uploaded_at_utc": "2026-07-26T17:01:20.134313Z"
    },
    {
      "artifact_id": "apsw/3.53.4.0/ubuntu-24.04/3.14.7",
      "runner_label": "ubuntu-24.04",
      "python_version": "3.14.7",
      "architecture": "x86_64",
      "os": "Ubuntu",
      "os_version_family": "24.04",
      "product_type": "not_applicable",
      "filename": "apsw-3.53.4.0-cp314-cp314-manylinux_2_28_x86_64.whl",
      "platform_tag": "manylinux_2_28_x86_64",
      "download_url": "https://files.pythonhosted.org/packages/14/5e/aeacd13a10cbdc0e25974b6415105fd6ce06a1e09c412345d98a830aa14f/apsw-3.53.4.0-cp314-cp314-manylinux_2_28_x86_64.whl",
      "size_bytes": 3647954,
      "sha256": "979f69f2ade92a2afd2f67208217cf2ba174e237f7edc936ecd5af28340a463e",
      "provenance_url": "https://pypi.org/integrity/apsw/3.53.4.0/apsw-3.53.4.0-cp314-cp314-manylinux_2_28_x86_64.whl/provenance",
      "uploaded_at_utc": "2026-07-26T17:01:46.874702Z"
    },
    {
      "artifact_id": "apsw/3.53.4.0/ubuntu-24.04-arm/3.10.21",
      "runner_label": "ubuntu-24.04-arm",
      "python_version": "3.10.21",
      "architecture": "aarch64",
      "os": "Ubuntu",
      "os_version_family": "24.04",
      "product_type": "not_applicable",
      "filename": "apsw-3.53.4.0-cp310-cp310-manylinux_2_28_aarch64.whl",
      "platform_tag": "manylinux_2_28_aarch64",
      "download_url": "https://files.pythonhosted.org/packages/3b/aa/8793494c648e93c94bb9bf629ef5b557fa3e5a8a5c7402554442de3bd46b/apsw-3.53.4.0-cp310-cp310-manylinux_2_28_aarch64.whl",
      "size_bytes": 3555730,
      "sha256": "caf15026394789e508991d43423937ab1d1cf07df8866876ce998d84862ed209",
      "provenance_url": "https://pypi.org/integrity/apsw/3.53.4.0/apsw-3.53.4.0-cp310-cp310-manylinux_2_28_aarch64.whl/provenance",
      "uploaded_at_utc": "2026-07-26T16:59:54.271326Z"
    },
    {
      "artifact_id": "apsw/3.53.4.0/ubuntu-24.04-arm/3.11.16",
      "runner_label": "ubuntu-24.04-arm",
      "python_version": "3.11.16",
      "architecture": "aarch64",
      "os": "Ubuntu",
      "os_version_family": "24.04",
      "product_type": "not_applicable",
      "filename": "apsw-3.53.4.0-cp311-cp311-manylinux_2_28_aarch64.whl",
      "platform_tag": "manylinux_2_28_aarch64",
      "download_url": "https://files.pythonhosted.org/packages/af/f3/1909e2b2b30e1315ae27324ea272fc807eb6e3ca08930ac70ad29c6b58da/apsw-3.53.4.0-cp311-cp311-manylinux_2_28_aarch64.whl",
      "size_bytes": 3495567,
      "sha256": "149fe6f761456ceb2b9f4c8b9c33dad9142544e6417267477b7a9d5b93da70e5",
      "provenance_url": "https://pypi.org/integrity/apsw/3.53.4.0/apsw-3.53.4.0-cp311-cp311-manylinux_2_28_aarch64.whl/provenance",
      "uploaded_at_utc": "2026-07-26T17:00:21.924612Z"
    },
    {
      "artifact_id": "apsw/3.53.4.0/ubuntu-24.04-arm/3.12.14",
      "runner_label": "ubuntu-24.04-arm",
      "python_version": "3.12.14",
      "architecture": "aarch64",
      "os": "Ubuntu",
      "os_version_family": "24.04",
      "product_type": "not_applicable",
      "filename": "apsw-3.53.4.0-cp312-cp312-manylinux_2_28_aarch64.whl",
      "platform_tag": "manylinux_2_28_aarch64",
      "download_url": "https://files.pythonhosted.org/packages/d9/bd/520cfc025a80c11fd7c2de0c2361ce4ec39dff822888585c2ba333110016/apsw-3.53.4.0-cp312-cp312-manylinux_2_28_aarch64.whl",
      "size_bytes": 3487559,
      "sha256": "4760a026284318d5de6937a14add0d03b194ea60bf67fb51bdd28b541a249229",
      "provenance_url": "https://pypi.org/integrity/apsw/3.53.4.0/apsw-3.53.4.0-cp312-cp312-manylinux_2_28_aarch64.whl/provenance",
      "uploaded_at_utc": "2026-07-26T17:00:48.298471Z"
    },
    {
      "artifact_id": "apsw/3.53.4.0/ubuntu-24.04-arm/3.13.15",
      "runner_label": "ubuntu-24.04-arm",
      "python_version": "3.13.15",
      "architecture": "aarch64",
      "os": "Ubuntu",
      "os_version_family": "24.04",
      "product_type": "not_applicable",
      "filename": "apsw-3.53.4.0-cp313-cp313-manylinux_2_28_aarch64.whl",
      "platform_tag": "manylinux_2_28_aarch64",
      "download_url": "https://files.pythonhosted.org/packages/58/27/c791001d0380d9ed6fbb34e6975546fc0dbd6520aa88b25eba2c22033120/apsw-3.53.4.0-cp313-cp313-manylinux_2_28_aarch64.whl",
      "size_bytes": 3484996,
      "sha256": "0b5ccae16a9efdeca6fdbbe91330e73530782b4d98ee1c20054ae0b72efdabf3",
      "provenance_url": "https://pypi.org/integrity/apsw/3.53.4.0/apsw-3.53.4.0-cp313-cp313-manylinux_2_28_aarch64.whl/provenance",
      "uploaded_at_utc": "2026-07-26T17:01:13.410540Z"
    },
    {
      "artifact_id": "apsw/3.53.4.0/ubuntu-24.04-arm/3.14.7",
      "runner_label": "ubuntu-24.04-arm",
      "python_version": "3.14.7",
      "architecture": "aarch64",
      "os": "Ubuntu",
      "os_version_family": "24.04",
      "product_type": "not_applicable",
      "filename": "apsw-3.53.4.0-cp314-cp314-manylinux_2_28_aarch64.whl",
      "platform_tag": "manylinux_2_28_aarch64",
      "download_url": "https://files.pythonhosted.org/packages/d3/d9/79ec37e57e3b7fed286ba7ae7136512efe32e9b65010b7d850c160615983/apsw-3.53.4.0-cp314-cp314-manylinux_2_28_aarch64.whl",
      "size_bytes": 3485943,
      "sha256": "8665b7e10bb97262bc821444469c0ed60bd039f5a2236dacb362e160a4a66097",
      "provenance_url": "https://pypi.org/integrity/apsw/3.53.4.0/apsw-3.53.4.0-cp314-cp314-manylinux_2_28_aarch64.whl/provenance",
      "uploaded_at_utc": "2026-07-26T17:01:40.967631Z"
    },
    {
      "artifact_id": "apsw/3.53.4.0/macos-15-intel/3.10.21",
      "runner_label": "macos-15-intel",
      "python_version": "3.10.21",
      "architecture": "x86_64",
      "os": "macOS",
      "os_version_family": "15",
      "product_type": "not_applicable",
      "filename": "apsw-3.53.4.0-cp310-cp310-macosx_10_9_x86_64.whl",
      "platform_tag": "macosx_10_9_x86_64",
      "download_url": "https://files.pythonhosted.org/packages/6c/21/efe6ffd8680bba0cde918ad37e10c94896a7a0c0fe0ef5dbf8e97f88fd71/apsw-3.53.4.0-cp310-cp310-macosx_10_9_x86_64.whl",
      "size_bytes": 3269707,